{
  "advertised_profile": "actor",
  "candidate": "trealla",
  "counts": {
    "fail": 0,
    "pass": 10,
    "unsupported": 0
  },
  "duration_ms": 1935,
  "results": [
    {
      "duration_ms": 82,
      "id": "BH-001",
      "status": "pass",
      "title": "Generic server requests thread callback state"
    },
    {
      "duration_ms": 67,
      "id": "BH-002",
      "status": "pass",
      "title": "Generic server promises correlate asynchronous replies"
    },
    {
      "duration_ms": 65,
      "id": "BH-003",
      "status": "pass",
      "title": "Generic server upgrade replaces the callback and preserves state"
    },
    {
      "duration_ms": 103,
      "id": "BH-004",
      "status": "pass",
      "title": "Supervisor starts and counts distinct worker children"
    },
    {
      "duration_ms": 81,
      "id": "BH-005",
      "status": "pass",
      "title": "Supervisor supports dynamic start, terminate, restart, and delete"
    },
    {
      "duration_ms": 399,
      "id": "BH-006",
      "status": "pass",
      "title": "One-for-one restart replaces only the failed child"
    },
    {
      "duration_ms": 415,
      "id": "BH-007",
      "status": "pass",
      "title": "One-for-all restart replaces every child"
    },
    {
      "duration_ms": 260,
      "id": "BH-008",
      "status": "pass",
      "title": "Temporary and transient children are not restarted after terminal exits"
    },
    {
      "duration_ms": 355,
      "id": "BH-009",
      "status": "pass",
      "title": "Nested supervisor failure restarts its subtree without restarting siblings"
    },
    {
      "duration_ms": 107,
      "id": "BH-010",
      "status": "pass",
      "title": "Supervisor manages a generic server child with graceful shutdown"
    }
  ],
  "schema_version": 1,
  "started_at": "2026-10-21T10:43:09.228255+00:00",
  "suite": "actor-behaviours-0.1",
  "ws_url": "ws://127.0.0.1:61012/ws"
}
