{
  "advertised_profile": "actor",
  "candidate": "swi",
  "counts": {
    "fail": 0,
    "pass": 7,
    "unsupported": 0
  },
  "duration_ms": 89,
  "results": [
    {
      "duration_ms": 3,
      "id": "AC-001",
      "status": "pass",
      "title": "Transport negotiation accepts protocol version 1 and browser capabilities"
    },
    {
      "duration_ms": 12,
      "id": "AC-002",
      "status": "pass",
      "title": "Session self/1 is deterministic and denotes the spawned shell"
    },
    {
      "duration_ms": 12,
      "id": "AC-003",
      "status": "pass",
      "title": "Paged toplevel enumeration preserves bindings and final-page state"
    },
    {
      "duration_ms": 14,
      "id": "AC-004",
      "status": "pass",
      "title": "Guarded receive selects the non-positive clause and emits one line"
    },
    {
      "duration_ms": 13,
      "id": "AC-005",
      "status": "pass",
      "title": "Selective receive retains an earlier unmatched message"
    },
    {
      "duration_ms": 13,
      "id": "AC-006",
      "status": "pass",
      "title": "Direct browser input suspends until toplevel_respond"
    },
    {
      "duration_ms": 21,
      "id": "AC-007",
      "status": "pass",
      "title": "Nested toplevel input is delivered to its protocol caller"
    }
  ],
  "schema_version": 1,
  "started_at": "2026-10-21T19:37:11.911726+00:00",
  "suite": "actor-core-0.1",
  "ws_url": "ws://127.0.0.1:55146/ws"
}
