{
  "advertised_profile": "actor",
  "candidate": "trealla",
  "counts": {
    "fail": 0,
    "pass": 7,
    "unsupported": 0
  },
  "duration_ms": 95,
  "results": [
    {
      "duration_ms": 14,
      "id": "TXT-001",
      "status": "pass",
      "title": "A double-quoted literal is a list of one-character atoms"
    },
    {
      "duration_ms": 13,
      "id": "TXT-002",
      "status": "pass",
      "title": "The empty double-quoted literal is the empty list"
    },
    {
      "duration_ms": 12,
      "id": "TXT-003",
      "status": "pass",
      "title": "A non-ASCII literal contains one Unicode character atom rather than UTF-8 bytes"
    },
    {
      "duration_ms": 12,
      "id": "TXT-004",
      "status": "pass",
      "title": "Double-quoted terminals retain DCG list semantics"
    },
    {
      "duration_ms": 18,
      "id": "TXT-005",
      "status": "pass",
      "title": "Source loaded into a session uses character-list semantics"
    },
    {
      "duration_ms": 13,
      "id": "TXT-006",
      "status": "pass",
      "title": "A serialized text binding can be resubmitted with the same list meaning"
    },
    {
      "duration_ms": 12,
      "id": "TXT-007",
      "status": "pass",
      "title": "Double-quoted text supports ordinary relational list operations"
    }
  ],
  "schema_version": 1,
  "started_at": "2026-10-21T10:57:56.368923+00:00",
  "suite": "portable-text-0.1",
  "ws_url": "ws://127.0.0.1:61995/ws"
}
