{
  "advertised_profile": "actor",
  "candidate": "trealla",
  "counts": {
    "fail": 0,
    "pass": 8,
    "unsupported": 0
  },
  "duration_ms": 5623,
  "results": [
    {
      "duration_ms": 262,
      "id": "WC-001",
      "status": "pass",
      "title": "Parallel preserves independent bindings and accepts an empty list"
    },
    {
      "duration_ms": 535,
      "id": "WC-002",
      "status": "pass",
      "title": "Parallel reports logical failure and propagates original exceptions"
    },
    {
      "duration_ms": 1264,
      "id": "WC-003",
      "status": "pass",
      "title": "Both first_solution arities select a winner and reject an empty solver list"
    },
    {
      "duration_ms": 867,
      "id": "WC-004",
      "status": "pass",
      "title": "Continue policies produce a final winning page after failure, exception or exit"
    },
    {
      "duration_ms": 1498,
      "id": "WC-005",
      "status": "pass",
      "title": "Unexpected exits and stop policies produce the documented outcome"
    },
    {
      "duration_ms": 152,
      "id": "WC-006",
      "status": "pass",
      "title": "Workers resolve supplied predicates and preserve answer variable sharing"
    },
    {
      "duration_ms": 522,
      "id": "WC-007",
      "status": "pass",
      "title": "A winning first_solution reclaims its loser and preserves unrelated state"
    },
    {
      "duration_ms": 523,
      "id": "WC-008",
      "status": "pass",
      "title": "A failing parallel call reclaims its blocked sibling and preserves unrelated state"
    }
  ],
  "schema_version": 1,
  "started_at": "2026-10-25T11:14:08.988002+00:00",
  "suite": "actor-workers-0.1",
  "ws_url": "ws://127.0.0.1:51931/ws"
}
