{
  "advertised_profile": "actor",
  "candidate": "trealla",
  "counts": {
    "fail": 0,
    "pass": 5,
    "unsupported": 0
  },
  "duration_ms": 517,
  "results": [
    {
      "duration_ms": 66,
      "id": "SCD-001",
      "status": "pass",
      "title": "Exploratory runtime-bound nested child specifications at query admission"
    },
    {
      "duration_ms": 104,
      "id": "SCD-002",
      "status": "pass",
      "title": "Exploratory repeated monitoring and cleanup of already retired fixture actors"
    },
    {
      "duration_ms": 113,
      "id": "SCD-003",
      "status": "pass",
      "title": "Exploratory one-for-one replacement failure under public name contention"
    },
    {
      "duration_ms": 121,
      "id": "SCD-004",
      "status": "pass",
      "title": "Exploratory one-for-all replacement failure cleans up provisional replacements and original siblings"
    },
    {
      "duration_ms": 114,
      "id": "SCD-005",
      "status": "pass",
      "title": "Exploratory rest-for-one replacement failure cleans up replacements and the unaffected prefix"
    }
  ],
  "schema_version": 1,
  "started_at": "2026-10-21T10:06:11.426243+00:00",
  "suite": "supervisor-diagnostics-0.1",
  "ws_url": "ws://127.0.0.1:57360/ws"
}
