{
  "advertised_profile": "actor",
  "candidate": "swi",
  "counts": {
    "fail": 0,
    "pass": 1,
    "unsupported": 0
  },
  "duration_ms": 666,
  "results": [
    {
      "duration_ms": 666,
      "id": "WCD-001",
      "status": "pass",
      "title": "Exploratory repeated continue-policy calls for worker-cleanup ownership races"
    }
  ],
  "schema_version": 1,
  "started_at": "2026-10-21T10:24:33.222198+00:00",
  "suite": "worker-diagnostics-0.1",
  "ws_url": "ws://127.0.0.1:58304/ws"
}
