{
  "advertised_profile": "actor",
  "candidate": "swi-nested-recheck",
  "counts": {
    "fail": 1,
    "pass": 9,
    "unsupported": 0
  },
  "duration_ms": 4778,
  "results": [
    {
      "duration_ms": 103,
      "id": "SC-001",
      "status": "pass",
      "title": "Initial startup failure releases previously created child names and preserves the conflicting actor"
    },
    {
      "duration_ms": 55,
      "id": "SC-002",
      "status": "pass",
      "title": "Failed dynamic addition preserves siblings and permits retry"
    },
    {
      "duration_ms": 63,
      "id": "SC-003",
      "status": "pass",
      "title": "Failed explicit respawn retains the inactive specification and permits retry"
    },
    {
      "classification": "unclassified",
      "detail": "timeout: timed out",
      "duration_ms": 4079,
      "id": "SC-005",
      "status": "fail",
      "title": "One-for-all replacement failure cleans up provisional replacements and original siblings"
    },
    {
      "duration_ms": 69,
      "id": "SC-006",
      "status": "pass",
      "title": "Rest-for-one replacement failure cleans up replacements and the unaffected prefix"
    },
    {
      "duration_ms": 64,
      "id": "SC-007",
      "status": "pass",
      "title": "Zero restart budget performs policy cleanup under one-for-one"
    },
    {
      "duration_ms": 69,
      "id": "SC-008",
      "status": "pass",
      "title": "Zero restart budget performs policy cleanup under one-for-all"
    },
    {
      "duration_ms": 68,
      "id": "SC-009",
      "status": "pass",
      "title": "Zero restart budget performs policy cleanup under rest-for-one"
    },
    {
      "duration_ms": 85,
      "id": "SC-010",
      "status": "pass",
      "title": "Two permitted restarts precede intensity exhaustion"
    },
    {
      "duration_ms": 122,
      "id": "SC-011",
      "status": "pass",
      "title": "Exhaustion honours numeric and brutal-kill shutdown policies"
    }
  ],
  "schema_version": 1,
  "started_at": "2026-10-20T11:35:28.697992+00:00",
  "suite": "actor-supervisors-0.1",
  "ws_url": "ws://127.0.0.1:39860/ws"
}
