{
  "advertised_profile": "actor",
  "candidate": "swi-nested-recheck",
  "counts": {
    "fail": 1,
    "pass": 4,
    "unsupported": 0
  },
  "duration_ms": 286,
  "results": [
    {
      "classification": "unclassified",
      "detail": "ConformanceFailure: expected success, got {'data': 'Arguments are not sufficiently instantiated', 'details': 'error(instantiation_error,_)', 'type': 'error'}; preceding events were []",
      "duration_ms": 34,
      "id": "SCD-001",
      "status": "fail",
      "title": "Exploratory runtime-bound nested child specifications at query admission"
    },
    {
      "duration_ms": 65,
      "id": "SCD-002",
      "status": "pass",
      "title": "Exploratory repeated monitoring and cleanup of already retired fixture actors"
    },
    {
      "duration_ms": 60,
      "id": "SCD-003",
      "status": "pass",
      "title": "Exploratory one-for-one replacement failure under public name contention"
    },
    {
      "duration_ms": 68,
      "id": "SCD-004",
      "status": "pass",
      "title": "Exploratory one-for-all replacement failure cleans up provisional replacements and original siblings"
    },
    {
      "duration_ms": 59,
      "id": "SCD-005",
      "status": "pass",
      "title": "Exploratory rest-for-one replacement failure cleans up replacements and the unaffected prefix"
    }
  ],
  "schema_version": 1,
  "started_at": "2026-10-20T11:53:47.023811+00:00",
  "suite": "supervisor-diagnostics-0.1",
  "ws_url": "ws://127.0.0.1:39860/ws"
}
