{
  "advertised_profile": "actor",
  "candidate": "swi-source-names-fixed",
  "counts": {
    "fail": 0,
    "pass": 1,
    "unsupported": 0
  },
  "duration_ms": 304,
  "results": [
    {
      "duration_ms": 304,
      "id": "BH-009",
      "status": "pass",
      "title": "Nested supervisor failure restarts its subtree without restarting siblings"
    }
  ],
  "schema_version": 1,
  "started_at": "2026-10-20T09:54:20.155984+00:00",
  "suite": "actor-behaviours-0.1",
  "ws_url": "ws://127.0.0.1:39860/ws"
}
