{
  "advertised_profile": "actor",
  "candidate": "swi",
  "counts": {
    "fail": 7,
    "pass": 0,
    "unsupported": 0
  },
  "duration_ms": 98,
  "results": [
    {
      "classification": "unclassified",
      "detail": "ConformanceFailure: expected success, got {'pid': 1424241057, 'type': 'failure'}",
      "duration_ms": 15,
      "id": "TXT-001",
      "status": "fail",
      "title": "A double-quoted literal is a list of one-character atoms"
    },
    {
      "classification": "unclassified",
      "detail": "ConformanceFailure: expected success, got {'pid': 5595789163, 'type': 'failure'}",
      "duration_ms": 13,
      "id": "TXT-002",
      "status": "fail",
      "title": "The empty double-quoted literal is the empty list"
    },
    {
      "classification": "unclassified",
      "detail": "ConformanceFailure: expected success, got {'pid': 2479446872, 'type': 'failure'}",
      "duration_ms": 13,
      "id": "TXT-003",
      "status": "fail",
      "title": "A non-ASCII literal contains one Unicode character atom rather than UTF-8 bytes"
    },
    {
      "classification": "unclassified",
      "detail": "ConformanceFailure: expected success, got {'data': 'Type error: list expected, found \"abcd\" (a string)', 'details': 'error(type_error(list,\"abcd\"),_)', 'pid': 3128981767, 'type': 'error'}",
      "duration_ms": 14,
      "id": "TXT-004",
      "status": "fail",
      "title": "Double-quoted terminals retain DCG list semantics"
    },
    {
      "classification": "unclassified",
      "detail": "ConformanceFailure: expected success, got {'pid': 1618762116, 'type': 'failure'}",
      "duration_ms": 14,
      "id": "TXT-005",
      "status": "fail",
      "title": "Source loaded into a session uses character-list semantics"
    },
    {
      "classification": "unclassified",
      "detail": "ConformanceFailure: expected success, got {'pid': 6034690273, 'type': 'failure'}",
      "duration_ms": 14,
      "id": "TXT-006",
      "status": "fail",
      "title": "A serialized text binding can be resubmitted with the same list meaning"
    },
    {
      "classification": "unclassified",
      "detail": "ConformanceFailure: expected success, got {'pid': 5013048059, 'type': 'failure'}",
      "duration_ms": 13,
      "id": "TXT-007",
      "status": "fail",
      "title": "Double-quoted text supports ordinary relational list operations"
    }
  ],
  "schema_version": 1,
  "started_at": "2026-10-21T19:38:51.125967+00:00",
  "suite": "portable-text-0.1",
  "ws_url": "ws://127.0.0.1:55594/ws"
}
