{
  "advertised_profile": "actor",
  "candidate": "trealla",
  "counts": {
    "fail": 0,
    "pass": 8,
    "unsupported": 0
  },
  "duration_ms": 849,
  "results": [
    {
      "duration_ms": 101,
      "id": "SC-001",
      "status": "pass",
      "title": "Initial startup failure releases previously created child names and preserves the conflicting actor"
    },
    {
      "duration_ms": 102,
      "id": "SC-002",
      "status": "pass",
      "title": "Failed dynamic addition preserves siblings and permits retry"
    },
    {
      "duration_ms": 111,
      "id": "SC-003",
      "status": "pass",
      "title": "Failed explicit respawn retains the inactive specification and permits retry"
    },
    {
      "duration_ms": 87,
      "id": "SC-007",
      "status": "pass",
      "title": "Zero restart budget performs policy cleanup under one-for-one"
    },
    {
      "duration_ms": 88,
      "id": "SC-008",
      "status": "pass",
      "title": "Zero restart budget performs policy cleanup under one-for-all"
    },
    {
      "duration_ms": 90,
      "id": "SC-009",
      "status": "pass",
      "title": "Zero restart budget performs policy cleanup under rest-for-one"
    },
    {
      "duration_ms": 107,
      "id": "SC-010",
      "status": "pass",
      "title": "Two permitted restarts precede intensity exhaustion"
    },
    {
      "duration_ms": 162,
      "id": "SC-011",
      "status": "pass",
      "title": "Exhaustion honours numeric and brutal-kill shutdown policies"
    }
  ],
  "schema_version": 1,
  "started_at": "2026-10-21T10:57:54.079630+00:00",
  "suite": "actor-supervisors-0.1",
  "ws_url": "ws://127.0.0.1:61995/ws"
}
