{
  "advertised_profile": "actor",
  "candidate": "swi-worker-batch",
  "counts": {
    "fail": 1,
    "pass": 7,
    "unsupported": 0
  },
  "duration_ms": 808,
  "results": [
    {
      "duration_ms": 75,
      "id": "WC-001",
      "status": "pass",
      "title": "Parallel preserves independent bindings and accepts an empty list"
    },
    {
      "duration_ms": 78,
      "id": "WC-002",
      "status": "pass",
      "title": "Parallel reports logical failure and propagates original exceptions"
    },
    {
      "duration_ms": 131,
      "id": "WC-003",
      "status": "pass",
      "title": "Both first_solution arities select a winner and reject an empty solver list"
    },
    {
      "classification": "unclassified",
      "detail": "ConformanceFailure: expected success, got {'data': \"actors:exit/2: No permission to exit actor 4226031917@'http://localhost:39860'' (target is outside the caller ownership tree)\", 'details': \"error(permission_error(exit,actor,4226031917@'http://localhost:39860'),_)\", 'pid': 1527966344, 'type': 'error'}; supplied_source=False",
      "duration_ms": 112,
      "id": "WC-004",
      "status": "fail",
      "title": "Continue policies produce a final winning page after failure, exception or exit"
    },
    {
      "duration_ms": 202,
      "id": "WC-005",
      "status": "pass",
      "title": "Unexpected exits and stop policies produce the documented outcome"
    },
    {
      "duration_ms": 28,
      "id": "WC-006",
      "status": "pass",
      "title": "Workers resolve supplied predicates and preserve answer variable sharing"
    },
    {
      "duration_ms": 90,
      "id": "WC-007",
      "status": "pass",
      "title": "A winning first_solution reclaims its loser and preserves unrelated state"
    },
    {
      "duration_ms": 91,
      "id": "WC-008",
      "status": "pass",
      "title": "A failing parallel call reclaims its blocked sibling and preserves unrelated state"
    }
  ],
  "schema_version": 1,
  "started_at": "2026-10-20T08:54:38.459107+00:00",
  "suite": "actor-workers-0.1",
  "ws_url": "ws://127.0.0.1:39860/ws"
}
