{
  "advertised_profile": "actor",
  "candidate": "trealla",
  "counts": {
    "fail": 0,
    "pass": 26,
    "unsupported": 0
  },
  "duration_ms": 3353,
  "results": [
    {
      "duration_ms": 120,
      "id": "TXT-001",
      "status": "pass",
      "title": "A double-quoted literal is a list of one-character atoms"
    },
    {
      "duration_ms": 122,
      "id": "TXT-002",
      "status": "pass",
      "title": "The empty double-quoted literal is the empty list"
    },
    {
      "duration_ms": 125,
      "id": "TXT-003",
      "status": "pass",
      "title": "A non-ASCII literal contains one Unicode character atom rather than UTF-8 bytes"
    },
    {
      "duration_ms": 123,
      "id": "TXT-004",
      "status": "pass",
      "title": "Double-quoted terminals retain DCG list semantics"
    },
    {
      "duration_ms": 140,
      "id": "TXT-005",
      "status": "pass",
      "title": "Source loaded into a session uses character-list semantics"
    },
    {
      "duration_ms": 126,
      "id": "TXT-006",
      "status": "pass",
      "title": "A serialized text binding can be resubmitted with the same list meaning"
    },
    {
      "duration_ms": 126,
      "id": "TXT-007",
      "status": "pass",
      "title": "Double-quoted text supports ordinary relational list operations"
    },
    {
      "duration_ms": 124,
      "id": "TXT-008",
      "status": "pass",
      "title": "A supplementary Unicode scalar is one character atom"
    },
    {
      "duration_ms": 128,
      "id": "TXT-009",
      "status": "pass",
      "title": "Combining marks are separate character atoms"
    },
    {
      "duration_ms": 120,
      "id": "TXT-010",
      "status": "pass",
      "title": "Reading preserves normalization distinctions"
    },
    {
      "duration_ms": 127,
      "id": "TXT-011",
      "status": "pass",
      "title": "Single-quoted text remains an atom"
    },
    {
      "duration_ms": 122,
      "id": "TXT-012",
      "status": "pass",
      "title": "Quoted text escapes preserve quotes and backslashes"
    },
    {
      "duration_ms": 135,
      "id": "TXT-013",
      "status": "pass",
      "title": "Quoted clauses in spawn options use the option reader semantics"
    },
    {
      "duration_ms": 145,
      "id": "TXT-014",
      "status": "pass",
      "title": "Constructed src_list terms preserve numeric lists and variable sharing"
    },
    {
      "duration_ms": 131,
      "id": "TXT-015",
      "status": "pass",
      "title": "Supplied DCG source compiles character terminals"
    },
    {
      "duration_ms": 138,
      "id": "TXT-016",
      "status": "pass",
      "title": "A private actor source module reads double quotes consistently"
    },
    {
      "duration_ms": 146,
      "id": "TXT-017",
      "status": "pass",
      "title": "Copied predicates preserve text through generated source"
    },
    {
      "duration_ms": 134,
      "id": "TXT-018",
      "status": "pass",
      "title": "URI-supplied source uses the same literal semantics"
    },
    {
      "duration_ms": 123,
      "id": "TXT-019",
      "status": "pass",
      "title": "Toplevel input replies use character-list literal semantics"
    },
    {
      "duration_ms": 128,
      "id": "TXT-020",
      "status": "pass",
      "title": "Unicode text survives serialized answer resubmission"
    },
    {
      "duration_ms": 129,
      "id": "TXT-021",
      "status": "pass",
      "title": "Empty text survives serialized answer resubmission"
    },
    {
      "duration_ms": 126,
      "id": "TXT-022",
      "status": "pass",
      "title": "Quotes and backslashes survive serialized answer resubmission"
    },
    {
      "duration_ms": 143,
      "id": "TXT-023",
      "status": "pass",
      "title": "A remote HTTP peer reads its supplied source consistently"
    },
    {
      "duration_ms": 135,
      "id": "TXT-024",
      "status": "pass",
      "title": "Remote answers preserve text code lists and variable sharing"
    },
    {
      "duration_ms": 117,
      "id": "TXT-025",
      "status": "pass",
      "title": "A joined emoji consists of scalar values rather than one grapheme"
    },
    {
      "duration_ms": 119,
      "id": "TXT-026",
      "status": "pass",
      "title": "Unicode input replies retain supplementary scalar characters"
    }
  ],
  "schema_version": 1,
  "started_at": "2026-10-25T11:20:03.860059+00:00",
  "suite": "portable-text-0.2",
  "ws_url": "ws://127.0.0.1:52662/ws"
}
